{
  "schema_version": 1,
  "release": "1.1",
  "generated_at": "2026-09-06T06:01:18.137856Z",
  "builder": {
    "tool": "scripts/build_provenance.py",
    "python": "3.14.6",
    "platform": "Windows-11-10.0.26200-SP0"
  },
  "inputs": [],
  "artifacts": [
    {
      "path": ".gitattributes",
      "sha256": "9cd4f13549fdfe179e2f8491fd9515f30e8bbdbc756721dccadbf594cbb3dd2d",
      "size": 99
    },
    {
      "path": ".github/ISSUE_TEMPLATE/bug_report.yml",
      "sha256": "992f5469359285dcebbb155da83964ac761bab8ae91d49467a5d3cea5b92eec8",
      "size": 977
    },
    {
      "path": ".github/workflows/validate.yml",
      "sha256": "328d0b29d036617c5d4b375bc0dfcd93833b8c5ae5c5853a732817eff691264c",
      "size": 4614
    },
    {
      "path": ".gitignore",
      "sha256": "d6338e6b859ae59eafddd6fcc8251daac67c7f2c283bfbb359fa85df7bc73605",
      "size": 580
    },
    {
      "path": "adapters/aider-desk/README.md",
      "sha256": "20b03d0d51661c5e513ade8ff5a27b632b6578fd213e35ab03f11ca8c9ceb211",
      "size": 5302
    },
    {
      "path": "adapters/amp/README.md",
      "sha256": "81bc951a6d4b9b052f94d21915837df1553f55192852e25d9ee14ab62188b17d",
      "size": 4686
    },
    {
      "path": "adapters/antigravity/README.md",
      "sha256": "d71ef4afb1cc8e8cbef32aa1746ee87e40be5c5adbadd3dcb53145e938cff830",
      "size": 5025
    },
    {
      "path": "adapters/antigravity-cli/README.md",
      "sha256": "b3b559dcc6adc5256180122e4870ce805f4fbce8204d17fe4dbaa2fdbd764c51",
      "size": 5802
    },
    {
      "path": "adapters/augment/README.md",
      "sha256": "7cb9b454d1021e2fe045f64e7567a1832256f28c0f368abe7bdbab225debac72",
      "size": 4785
    },
    {
      "path": "adapters/browsercode/README.md",
      "sha256": "b7c66afd896ef4de4ea1896dc41eeb32fe3a5f271286ffa4b1a8fd13266baf61",
      "size": 5634
    },
    {
      "path": "adapters/chatgpt/README.md",
      "sha256": "5d128b56f3a3a6b67e987722a970abe10c2f6c898a3261597c8bb854ce2cc0b4",
      "size": 4747
    },
    {
      "path": "adapters/claude-app/README.md",
      "sha256": "6a7ac7a70fdd2613e2ab4294423b954554a81d1d9500849442fa44d9e1d7fabe",
      "size": 4484
    },
    {
      "path": "adapters/claude-code/README.md",
      "sha256": "018c2183667173362fe8d68ece2f245ac71e07bbce25719ae6b8bca11b65938f",
      "size": 5884
    },
    {
      "path": "adapters/cline/README.md",
      "sha256": "3ba2f340077ea4d66edba9792c2be10b6e47305b5888cae65088cac031dc251f",
      "size": 5257
    },
    {
      "path": "adapters/codex/README.md",
      "sha256": "1e5f19ea7eccb8c0d8046cb92084d5196d6ed36dc4695f8d11d746d59c2ac207",
      "size": 5841
    },
    {
      "path": "adapters/continue/README.md",
      "sha256": "9a5ad52d501aaa837f5a5908f17f1ef0ae8d0f6b40bff996ab18db5fb0c81c05",
      "size": 5288
    },
    {
      "path": "adapters/crush/README.md",
      "sha256": "3e3999e383d26f943b74daebe44ef3129dd19f279342ac6df1c8e08b31dad3ab",
      "size": 4397
    },
    {
      "path": "adapters/cursor/README.md",
      "sha256": "a34494f194843dc248ac7f2f24394acc3b9ed4600153ecceaa78b5694c3a0c9f",
      "size": 4904
    },
    {
      "path": "adapters/custom-cli/README.md",
      "sha256": "a4d477605ac76e180b3584351169c6b13b6eebe0fccb10e88dcb1006f541cd4c",
      "size": 4324
    },
    {
      "path": "adapters/deepcode/README.md",
      "sha256": "cb2650132e14e00b5a3009f08b9e17d9cb55b66f1bc5a901d76b24f2aa6c1577",
      "size": 5176
    },
    {
      "path": "adapters/deepseek/README.md",
      "sha256": "a9c4006d59d67af048263ca61d298d7035103bf65056686a00c8a516384e2708",
      "size": 4565
    },
    {
      "path": "adapters/devin/README.md",
      "sha256": "b1b02fcad3fbad9cff362d600c9986262b3f7948aa6342e92aaa0d3469b195f7",
      "size": 5160
    },
    {
      "path": "adapters/factory-droid/README.md",
      "sha256": "89717330688b57e229d97a9895f30829b1cd71e2c435f657fb27e58d5b4ecf70",
      "size": 4376
    },
    {
      "path": "adapters/future-agent/README.md",
      "sha256": "04c8a92f058dacb073a3d61bc8f23e6561ad12cedc1e8269bda12a928a311d4b",
      "size": 4301
    },
    {
      "path": "adapters/gemini-apps/README.md",
      "sha256": "e759b01202c71fc3e57834d08d196ddd997ce076d7abd6b5953597fbe89dd58e",
      "size": 4686
    },
    {
      "path": "adapters/gemini-cli/README.md",
      "sha256": "b9f16217bc33f97623189501e77c4f3b3aa382d0000dc0ddf9ddbf6b2da3bc55",
      "size": 4617
    },
    {
      "path": "adapters/generic/PROMPT.md",
      "sha256": "1c1e7d233a36638e66421bc526e153c8150661dfde8ac7f4b19f8c762f459c55",
      "size": 6319
    },
    {
      "path": "adapters/generic/README.md",
      "sha256": "63c60f90785a8e3b9b4e71508f993210c863294a1d2413d2b7006574dd7c7afb",
      "size": 1000
    },
    {
      "path": "adapters/github-copilot/README.md",
      "sha256": "aabfddd74df28e12000ff46e57e2624a53d8aece9acbf7fe3de40ff376811396",
      "size": 5226
    },
    {
      "path": "adapters/glm/README.md",
      "sha256": "9fc69e2e0530d95937f356aa13960af946638aacafd54e1110063629e372dbbb",
      "size": 4218
    },
    {
      "path": "adapters/goose/README.md",
      "sha256": "f117d2628c14e9d3ca9ced001317d55ab2a82112649be121f2ca488361e69354",
      "size": 5275
    },
    {
      "path": "adapters/grok/README.md",
      "sha256": "d1c96b13ebb47ae7a88e3d3121c007c3bc01c41ae23bc28e767b8ac86a242d8b",
      "size": 4374
    },
    {
      "path": "adapters/iflow-cli/README.md",
      "sha256": "952573a36274f503abb0870eb937965f0e1519dc3dd57f8e8e65bd510eefd6b7",
      "size": 5104
    },
    {
      "path": "adapters/junie/README.md",
      "sha256": "b24dc29aa08f459ccc68b0addb661b46af1407f0ca2317a89bf1bd16f904cba1",
      "size": 4647
    },
    {
      "path": "adapters/kilo-code/README.md",
      "sha256": "d60d7d1859998b2f7e41fe99c33ece81ce00c25b6ef699c6a8d996f7d21111e0",
      "size": 4750
    },
    {
      "path": "adapters/kimi/README.md",
      "sha256": "ffa2d4faa7cfe44bfce4f4302d40579702549f4fdc81732cce1c51f3fc059477",
      "size": 5200
    },
    {
      "path": "adapters/kiro-cli/README.md",
      "sha256": "a6638e2d6fcf0d413c38c389194648225db3ad391095be2ea7fba1491d8b5c54",
      "size": 4601
    },
    {
      "path": "adapters/longcat/README.md",
      "sha256": "ac9fd8286b06cd8122275a5cf5d8ab78e032c67f9825da46a1d5818c413f5288",
      "size": 4225
    },
    {
      "path": "adapters/manus/README.md",
      "sha256": "121d94b53399678a5ea5fee69c4c3a5ddeea157f6a998116da06e9b03b194dc7",
      "size": 4475
    },
    {
      "path": "adapters/mcpjam/README.md",
      "sha256": "710d72724bda7383cf573a4f1716d77e763a86a4f1d4eb033a72fa69d02f92ac",
      "size": 5136
    },
    {
      "path": "adapters/meta-muse/README.md",
      "sha256": "3d35bd03c1a40484599a4e26e6844210ddeaba5d9544b24de28c38477781dd89",
      "size": 4295
    },
    {
      "path": "adapters/mimo/README.md",
      "sha256": "eca7ea086000777f0af3b3ef06fbcc6eeb2a99d064775c28a0fe7ca04b1ba983",
      "size": 4254
    },
    {
      "path": "adapters/minimax/README.md",
      "sha256": "5cf57aad4fadf9a3452498c9454042c0fce1d6f09a0a041076f6182169315f5f",
      "size": 4630
    },
    {
      "path": "adapters/mistral/README.md",
      "sha256": "85246822a402730d3fe45ade97ef7240a6928e3aac4a07b89118ec722bf40bb7",
      "size": 4303
    },
    {
      "path": "adapters/model-provider/README.md",
      "sha256": "e3077ccb9b9fa1f2c317ab70640d18e93dc987c09c92537ee3666b2a2cbd51bb",
      "size": 1645
    },
    {
      "path": "adapters/mux/README.md",
      "sha256": "b4c614b756e01eca11d4c6380d27e99e9301ca37f78c4814e05329625fc4fbb2",
      "size": 5276
    },
    {
      "path": "adapters/neovate/README.md",
      "sha256": "c66d5607662cca3b9f5d8c1980a068fc9060f4cfe9251bb3a8ddad830f6a054d",
      "size": 5279
    },
    {
      "path": "adapters/openai-plugin/README.md",
      "sha256": "70b2d21f2b77c3df421a00d16417332e703720b152c52035002dcf0fbcce2496",
      "size": 4670
    },
    {
      "path": "adapters/opencode/README.md",
      "sha256": "a929e760e438558c15d7b7cda391e0b73ab7576451a2011d1d4438fa8e102991",
      "size": 4607
    },
    {
      "path": "adapters/openhands/README.md",
      "sha256": "cb40c911e093c9748a683d706192c92a205ddb09d219e8cd193f4d33a4cd5953",
      "size": 4795
    },
    {
      "path": "adapters/pi/README.md",
      "sha256": "ab3e4ede7a721a20dec9e6c3161983ceaef99317c0cb42a7422fe992f9493a6e",
      "size": 4599
    },
    {
      "path": "adapters/qoder/README.md",
      "sha256": "fc380d23c6390258dc4e87290851407d7b3aa03ecfe1756982ae8cefbf0651a8",
      "size": 4587
    },
    {
      "path": "adapters/qwen/README.md",
      "sha256": "1e797bd1232098975f22a4e815112953bfb076bb938544602b4f4e5203109fd7",
      "size": 4517
    },
    {
      "path": "adapters/README.md",
      "sha256": "f4f01fe43ed6ce0fe39f395256ccbcdd2456540d22690c57da7a87bbca2e354f",
      "size": 1679
    },
    {
      "path": "adapters/replit/README.md",
      "sha256": "4e7fcb39d8a1049f40bfb5bf9ddcad7591c0ba76cfadcbf969e5ffdd47e62409",
      "size": 4603
    },
    {
      "path": "adapters/roo-code/README.md",
      "sha256": "427b445400bf70aa1707923715f74f3f5457fadb0ea9f6c63eb46ee51f845f24",
      "size": 4957
    },
    {
      "path": "adapters/sarvam/README.md",
      "sha256": "f2810febad94dd70a7662e846e4c382a054d64ca36954b243d923558c88a5073",
      "size": 4211
    },
    {
      "path": "adapters/trae/README.md",
      "sha256": "8abc1122cf61d2def78a815ee4c4aad702eacc3fdc4872cbdb4569f20eb1c3f6",
      "size": 5450
    },
    {
      "path": "adapters/warp/README.md",
      "sha256": "b3e130c71776182548af9a2aee6dac2859adfd8f11bec4c5dfbd3d1d4ce2e5b1",
      "size": 4594
    },
    {
      "path": "adapters/windsurf/README.md",
      "sha256": "0a23a45e87b61a74d7c18d445ab40025dcb2491702cc68e9c620b982d7336169",
      "size": 4719
    },
    {
      "path": "adapters/zcode/README.md",
      "sha256": "ea8bccdb5b4bd0f75ce6d7e4cf8b5171b99883b2ce5eab1d60218cc1fe1bd879",